{
  "id": "choline-crispri-nissle",
  "name": "Choline sensor (BetI + CRISPRi)",
  "slug": "choline-crispri-nissle",
  "shortDescription": "Detects choline, a dietary precursor of the cardiovascular-risk metabolite TMA/TMAO in the gut. The Marionette BetI sensor gates a CRISPRi circuit driving a fluorescent reporter, in the probiotic E. coli Nissle 1917.",
  "status": "template",
  "tags": ["choline", "TMAO", "metabolite", "clinical-gut", "probiotic", "Nissle", "Marionette", "CRISPRi"],
  "chassisSlug": "ecoli-nissle-1917",
  "input": { "analyte": "Choline", "category": "clinical-gut", "detects": "Luminal choline, the dietary precursor of gut-microbial TMA (and host TMAO)", "operatingRange": "BetI responds across µM-mM choline" },
  "sensing": { "strategy": "CRISPRi-repression", "casProtein": "dCas9 (S. pyogenes, catalytically dead)", "sensorMechanism": "BetI de-represses the Pbet promoter on binding choline.", "signalFlow": "Choline -> BetI releases Pbet -> transcribes an anti-reporter sgRNA -> CRISPRi inverts a constitutive reporter (NOT). Pair an inverter for turn-on monitoring of dietary choline load.", "logicType": "NOT" },
  "parts": [
    { "name": "BetI regulator", "role": "regulator", "source": "Marionette sensor (Meyer et al. 2019); E. coli bet system", "notes": "Choline-responsive repressor." },
    { "name": "Pbet promoter", "role": "promoter", "source": "E. coli betIBA promoter", "notes": "De-repressed by choline-bound BetI." },
    { "name": "Anti-reporter sgRNA", "role": "sgRNA", "source": "designed against the reporter promoter" },
    { "name": "sgRNA scaffold (SpCas9)", "role": "sgRNA", "sequence": "GTTTTAGAGCTAGAAATAGCAAGTTAAAATAAGGCTAGTCCGTTATCAACTTGAAAAAGTGGCACCGAGTCGGTGC", "source": "Standard SpCas9 scaffold" },
    { "name": "dCas9", "role": "dCas9", "source": "Qi et al. 2013 (CRISPRi)" },
    { "name": "sfGFP reporter", "role": "reporter", "source": "Pedelacq et al. 2006", "notes": "Recoverable from stool for non-invasive readout." }
  ],
  "output": { "type": "fluorescent", "reporterGene": "sfGFP", "readout": "Fluorescence (flow cytometry on recovered cells)", "result": "Signal reflects luminal choline load." },
  "performance": { "limitOfDetection": "BetI Marionette sensor: µM-mM choline (module-validated).", "dynamicRange": "~10 µM - 1 mM choline", "responseTimeMin": 240, "validated": false, "notes": "BetI is a characterised orthogonal Marionette sensor; integrated CRISPRi device is a design template. Relevant to TMAO/cardiovascular research." },
  "safety": { "biosafetyLevel": 1, "grasChassis": false, "biocontainment": "Probiotic E. coli Nissle host; add thyA/dapA auxotrophy for gut-restricted containment.", "fieldDeployable": false, "notes": "Probiotic chassis with a human-safety record; research / supervised clinical use only." },
  "buildSteps": [
    { "order": 1, "stage": "design", "title": "Design anti-reporter sgRNA", "description": "Target the reporter promoter; check Nissle off-targets." },
    { "order": 2, "stage": "assembly", "title": "Assemble units", "description": "TU1: BetI + Pbet -> sgRNA. TU2: dCas9 + constitutive sfGFP. Low-copy vector." },
    { "order": 3, "stage": "transformation", "title": "Transform E. coli Nissle 1917", "description": "Select; add auxotrophic containment." },
    { "order": 4, "stage": "induction", "title": "Validate in vitro", "description": "Confirm choline response across a standard curve before any animal work." },
    { "order": 5, "stage": "readout", "title": "Recover and measure", "description": "Recover cells from stool; quantify fluorescence." }
  ],
  "provenance": { "source": "Design template combining the Marionette BetI choline sensor with a dCas9 CRISPRi circuit in E. coli Nissle", "partsSources": ["Meyer et al. 2019, Nat. Chem. Biol. (Marionette sensors, BetI)", "Qi et al. 2013, Cell (CRISPRi)"], "license": "Parts per their original sources; design template CC BY 4.0", "addedBy": "seed", "dateAdded": "2026-06-28" }
}
